{
  "site_title_part2": "| Fotograf",
  "header_navigation_links": [
    {
      "label": "Domů",
      "url": "/"
    },
    {
      "label": "Galerie",
      "url": "/galerie"
    },
    {
      "label": "O mně",
      "url": "/omne"
    },
    {
      "label": "Služby",
      "url": "/sluzby"
    },
    {
      "label": "Kontakt",
      "url": "/kontakt"
    }
  ],
  "instagram_username": "adamsroams",
  "footer_intro_text": "## Tady to nemusí končit\n\nDěkuji za návštevu mojí stránky. Pokud máte jakýkoliv dotaz, neváhejte a napište mi. Budu se těšit na vzájemnou spolupráci!",
  "logo_image": "/favicons/cropped-favicon-06-300x300.png",
  "copyright_text_base": "Copyright © 2025 Adam Bušina | Fotograf",
  "homepage_hero_heading": "Zaznamenám & doručím",
  "homepage_hero_cta_label": "Objednejte si mě",
  "footer_navigation_links": [],
  "header_cta_label": "Napište mi",
  "homepage_hero_subheading": "Jako reportážní fotograf se postarám o to, aby vaše akce byla profesionálně zaznamenána, a vy jste se nemuseli o nic starat.",
  "seo_description": "",
  "phone_number": "+420 605 856 680",
  "header_cta_link": "/kontakt",
  "homepage_hero_cta_link": "/kontakt",
  "contact_email": "info@adambusina.cz",
  "site_title_part1": "Adam Bušina"
}
